{
  "type": "digital_credentials_portrait_liveness_evidence",
  "profile": "haps.profile.digital-credentials-portrait-liveness/v0.1",
  "mode": "independent_liveness",
  "binding": {
    "challenge_id": "haps-chal-apple-dca-001",
    "approval_session_id": "session-apple-dca-001",
    "journey_id": "journey-apple-dca-001",
    "audience": "https://bank.example",
    "action_hash": "sha256:mH7b0s6x5m2n4yT1k4pQeQ",
    "issued_at": "2026-04-24T12:00:00Z",
    "expires_at": "2026-04-24T12:05:00Z"
  },
  "credential_presentation": {
    "source": "apple_wallet",
    "protocol": "digital_credentials_api+org-iso-mdoc",
    "presentation_ref": "dca-response-123",
    "presentation_hash": "sha256:9m4e2x6d8k1pQeR7sT0uVw",
    "issuer": {
      "id": "dmv.example",
      "kid": "iaca-key-1",
      "trust_anchor": "iaca:dmv.example"
    },
    "holder_auth": {
      "method": "apple_wallet_faceid_or_touchid",
      "result": "verified"
    },
    "portrait_hash": "sha256:E8u2bGx9f1YpQQqqqqqqqq"
  },
  "liveness": {
    "provider": "provider-a",
    "issuer": {
      "id": "https://provider-a.example",
      "kid": "provider-a-key-1"
    },
    "attestation_ref": "att-123",
    "attestation_hash": "sha256:4s4G9tYpQqRrSsTtUuVvWw",
    "result": "passed",
    "portrait_match": "passed",
    "assurance_level": "high",
    "verified_at": "2026-04-24T12:01:00Z"
  }
}